2026-03-08T20:40:33.029741+00:00,spell,Whispering Wine,GuideToOrimond,"Did you know that Whispering Wine, a level 1 Conjuration spell, whispers cryptic advice to those who drink from it, offering guidance on the mysteries of the socks?",llama3
2026-03-08T20:40:34.392926+00:00,spell,Royal Claim of Provision,GuideToOrimond,"Did you know that the Royal Claim of Provision allows Artificers, Sorcerers, and Wizards to manifest an item from sanctioned stores after a 10-minute casting time within a 10-foot radius?",llama3
2026-03-08T20:40:35.544891+00:00,spell,Fraying of the Loom,GuideToOrimond,"Did you know that the Fraying of the Loom spell can pull a creature partially free from reality's anchors, leaving it vulnerable to existential uncertainty?",llama3
2026-03-08T20:40:36.793036+00:00,monster,Cleft-Hoof Dune Grazer,GuideToOrimond,"Did you know that the Cleft-Hoof Dune Grazer can blend into its surroundings while basking in sunlight, making it nearly invisible to creatures at a distance?",llama3
2026-03-08T20:40:38.158924+00:00,spell,Pyric Rend,GuideToOrimond,"Did you know that Pyric Rend, a level 3 Evocation spell, unleashes a violent burst of living heat in an instant, tearing open a wound in the flow of pyric force?",llama3
2026-03-08T20:40:39.315056+00:00,species,Veithyn,TDB,"Did you know that Veithyn, a medium-sized species, can live up to 200 years due to their remarkable ability to maintain physical vitality well into old age?",llama3
2026-03-08T20:40:40.457137+00:00,spell,Rapid Reload,GuideToOrimond,"Did you know that with Rapid Reload, Rangers can rapidly reload their ranged weapons without pause, unshackling motion from hesitation for 9 rounds?",llama3
2026-03-08T20:40:41.710373+00:00,monster,Veil-Slip Lanternwyrm,GuideToOrimond,"Did you know that the Veil-Slip Lanternwyrm can effortlessly traverse thin planar seams, entering and exiting them as part of its movement with ease?",llama3
2026-03-08T20:40:42.895634+00:00,monster,Thunderback Bellumoose,GuideToOrimond,"Did you know the Thunderback Bellumoose's mighty roars can be heard from miles away, causing creatures within 60 feet to struggle with Perception checks?",llama3
2026-03-08T20:40:44.181810+00:00,spell,Thallan's Suppurating Lance,GuideToOrimond,"Did you know that Thallan's Suppurating Lance can be used to devastating effect when cast at a cluster of enemy creatures, causing chaos and disarray within the affected area.",llama3
2026-03-08T20:40:45.344297+00:00,species,Cindralis,ORIO,"Did you know that Cindralis, a Medium-sized species, possess an uncanny Fine-Tuned Dexterity that allows them to navigate complex structures with ease?",llama3
2026-03-08T20:40:46.497487+00:00,monster,Cinder Sovereign,GuideToOrimond,"Did you know that the Cinder Sovereign, a CR 14 huge fiend, can command regional effects within its domain, making its presence felt far and wide.",llama3
2026-03-08T20:40:47.568198+00:00,species,Vitrexin,ORITMP,"Did you know that Vitrexin are medium-sized creatures with engineered circulation, allowing them to move at speeds of up to 30 feet?",llama3
2026-03-08T20:40:48.808545+00:00,monster,Glass-Eyed Nibblit,GuideToOrimond,"Did you know that when attacked, the Glass-Eyed Nibblit can flash its reflective eyes to force an attacker to make a saving throw against being blinded?",llama3
2026-03-08T20:40:50.192746+00:00,spell,Commoner's Glow-up,GuideToOrimond,"Did you know that with Commoner's Glow-up, a level 2 Transmutation spell, Bards can instantly refine their allies' appearances, making them seem more dignified and confident within 500 feet?",llama3
2026-03-08T20:40:51.396393+00:00,spell,The Jester's Wild Gambit,GuideToOrimond,"Did you know that The Jester's Wild Gambit can be cast at higher levels, allowing the Bard to maintain its chaotic influence for up to 4 minutes?",llama3
2026-03-08T20:40:52.609804+00:00,spell,Refusal Writ of the Crown,GuideToOrimond,"Did you know that the Refusal Writ of the Crown allows Paladins to reroll saving throws against binding forces with a swift reaction, upholding their sacred oaths?",llama3
2026-03-08T20:40:53.728571+00:00,spell,Verdant Irony,GuideToOrimond,"Did you know that with Verdant Irony, a Druid can turn the concrete jungle of Concord City into a lush oasis in just an hour?",llama3
2026-03-08T20:40:59.629766+00:00,spell,Splintered Howl,GuideToOrimond,"Did you know that the Splintered Howl, a Level 1 Enchantment castable by Bards, can unsettle the minds of nearby creatures with its unhuman echoes?",llama3
2026-03-08T20:41:00.896809+00:00,spell,Unbound Stone,GuideToOrimond,"Did you know that the Unbound Stone spell allows Sorcerers and Wizards to rewrite the obedience of matter itself, compelling solid substance to part and flow aside like water under command?",llama3
2026-03-08T20:41:02.173629+00:00,spell,Obliteration Memorandum,GuideToOrimond,"Did you know that the Obliteration Memorandum, a level 9 Necromancy spell, can instantly disrupt a target's bodily functions and fluids with a single, binding directive?",llama3
2026-03-08T20:41:03.402392+00:00,spell,Wisp of the Forgotten,GuideToOrimond,"Did you know that the Wisp of the Forgotten can be used to conjure a faint, ghostly whisper carrying an unintelligible message to a creature within range?",llama3
2026-03-08T20:41:04.627365+00:00,spell,Directional Sense,GuideToOrimond,"Did you know that with the cantrip Directional Sense, Rangers and Sorcerers alike can attune their awareness to subtle spatial cues for up to 10 minutes?",llama3
2026-03-08T20:41:06.071183+00:00,spell,Greaseproof Grip,GuideToOrimond,"Did you know that with Greaseproof Grip, a level 1 Transmutation spell, an Artificer can secure their grasp on a target creature within range, giving them advantage on Strength checks for up to one minute?",llama3
2026-03-08T20:41:07.252594+00:00,species,Mistaryn,ORIO,"Did you know that the Mistaryn's Veil-Adapted Form allows it to blend seamlessly into misty environments, making it nearly invisible in its natural habitat?",llama3
2026-03-08T20:41:08.647318+00:00,spell,Gourds and Wharfs,GuideToOrimond,"Did you know that Gourds and Wharfs, a Level 1 Conjuration spell, can conjure a curious arrangement of autumnal objects within 30 feet, determined by rolling a d6?",llama3
2026-03-08T20:41:09.913627+00:00,monster,Hollowbone Mire-Drake,GuideToOrimond,"Did you know the Hollowbone Mire-Drake can swim at an incredible 50 feet per turn, making it a formidable predator in Orimond's rivers and lakes?",llama3
2026-03-08T20:41:11.155254+00:00,spell,Seal of Severed Passage,GuideToOrimond,"Did you know that the Seal of Severed Passage, a level 8 Conjuration spell, creates an isolated area where no creature can teleport or use teleportation-based abilities?",llama3
2026-03-08T20:41:12.321599+00:00,spell,Verdant Renewal,GuideToOrimond,"Did you know that with Verdant Renewal, Druids and Paladins can channel the revitalizing energy of resilient greenery to heal themselves in mere moments?",llama3
2026-03-08T20:41:13.550135+00:00,spell,Splintered Howl,GuideToOrimond,"Did you know that Splintered Howl, a Level 1 Enchantment castable by Bards, instantly unsettles the minds of nearby creatures with its unhuman howling?",llama3
